[
  {
    "id": "ugm-brin-benchmark",
    "group": "cross-taxa",
    "role": "national benchmark",
    "priority": "high",
    "url": "https://ugm.ac.id/en/news/indonesia-records-31750-flora-and-744000-fauna-species-ugm-and-brin-urge-stronger-biodiversity-research/",
    "access": "public web",
    "authRequired": false,
    "retrievalMethod": "fetch",
    "license": "website terms apply",
    "citationHint": "Universitas Gadjah Mada news article citing BRIN and UGM benchmark counts",
    "releaseCadence": "ad hoc",
    "fieldMappingFocus": ["benchmark counts", "freshness note"],
    "rawSnapshotPath": "data/biodiversity/raw/ugm-brin-benchmark/",
    "checksumRequired": false,
    "notes": "Useful for national benchmark counts, not a downloadable checklist"
  },
  {
    "id": "brin-one-data-biodiversity",
    "group": "cross-taxa",
    "role": "indonesian authority",
    "priority": "high",
    "url": "https://www.brin.go.id/en/news/118065/wujudkan-one-data-indonesian-biodiversity-brin-tawarkan-akuisisi-data-sumber-daya-hayati-dan-non-hayati",
    "access": "public web + institutional data access",
    "authRequired": false,
    "retrievalMethod": "fetch",
    "license": "website terms apply",
    "citationHint": "BRIN news on One Data Indonesian Biodiversity initiative",
    "releaseCadence": "ad hoc",
    "fieldMappingFocus": ["institutional roadmap", "future access pathway"],
    "rawSnapshotPath": "data/biodiversity/raw/brin-one-data-biodiversity/",
    "checksumRequired": false,
    "notes": "Strategic source for future partnerships and official data acquisition"
  },
  {
    "id": "gbif",
    "group": "cross-taxa",
    "role": "occurrence backbone",
    "priority": "high",
    "url": "https://www.gbif.org/",
    "access": "public api",
    "authRequired": false,
    "retrievalMethod": "api",
    "license": "mixed publisher licenses via GBIF",
    "citationHint": "GBIF occurrence and taxonomic data with dataset-level attribution",
    "releaseCadence": "continuous",
    "fieldMappingFocus": ["occurrence evidence", "taxonomic reconciliation", "geographic gap analysis"],
    "rawSnapshotPath": "data/biodiversity/raw/gbif/",
    "checksumRequired": true,
    "notes": "Best general aggregator for species occurrences, reconciliation, and geographic gap analysis"
  },
  {
    "id": "gbif-indonesia-flora",
    "group": "flora",
    "role": "occurrence-backed flora summary",
    "priority": "high",
    "url": "https://api.gbif.org/v1/occurrence/search?country=ID&taxonKey=6",
    "access": "public api",
    "authRequired": false,
    "retrievalMethod": "api",
    "license": "mixed publisher licenses via GBIF",
    "citationHint": "GBIF occurrence search filtered to Indonesia and Plantae",
    "releaseCadence": "continuous",
    "fieldMappingFocus": ["flora occurrence counts", "top species facets", "top family facets", "recent sample records"],
    "rawSnapshotPath": "data/biodiversity/raw/gbif-indonesia-flora/",
    "checksumRequired": false,
    "notes": "Strong next flora connector because it is public, stable, and directly filterable to Indonesia + Plantae"
  },
  {
    "id": "gbif-indonesia-reptiles",
    "group": "fauna-reptiles",
    "role": "occurrence-backed reptile summary",
    "priority": "high",
    "url": "https://api.gbif.org/v1/occurrence/search?country=ID",
    "access": "public api",
    "authRequired": false,
    "retrievalMethod": "api",
    "license": "mixed publisher licenses via GBIF",
    "citationHint": "GBIF occurrence search filtered to Indonesia reptiles",
    "releaseCadence": "continuous",
    "fieldMappingFocus": ["reptile occurrence counts", "top species facets", "reptile group summary"],
    "rawSnapshotPath": "data/biodiversity/raw/gbif-indonesia-reptiles/",
    "checksumRequired": false,
    "notes": "Fallback reptile connector because public Reptile Database country filtering is not directly exposed via API"
  },
  {
    "id": "catalogue-of-life",
    "group": "cross-taxa",
    "role": "taxonomic backbone",
    "priority": "high",
    "url": "https://www.catalogueoflife.org/",
    "access": "public api",
    "authRequired": false,
    "retrievalMethod": "api",
    "license": "Catalogue of Life terms apply",
    "citationHint": "Catalogue of Life taxonomic backbone",
    "releaseCadence": "release based",
    "fieldMappingFocus": ["accepted names", "synonyms", "taxonomic identity"],
    "rawSnapshotPath": "data/biodiversity/raw/catalogue-of-life/",
    "checksumRequired": true,
    "notes": "Use for canonical names, synonym handling, and harmonization across sources"
  },
  {
    "id": "digital-flora-indonesia",
    "group": "flora",
    "role": "indonesia flora checklist",
    "priority": "high",
    "url": "https://www.indonesiaplants.org/",
    "access": "public web",
    "authRequired": false,
    "retrievalMethod": "fetch",
    "license": "website terms apply",
    "citationHint": "Digital Flora of Indonesia checklist pages",
    "releaseCadence": "continuous",
    "fieldMappingFocus": ["indonesia flora presence", "plant checklist enrichment"],
    "rawSnapshotPath": "data/biodiversity/raw/digital-flora-indonesia/",
    "checksumRequired": false,
    "notes": "Best Indonesia-focused flora source found in this audit"
  },
  {
    "id": "digital-flora-indonesia-angiosperms",
    "group": "flora",
    "role": "indonesia flora family and taxa pages",
    "priority": "high",
    "url": "https://www.indonesiaplants.org/angiosperms/",
    "access": "public web",
    "authRequired": false,
    "retrievalMethod": "fetch",
    "license": "website terms apply",
    "citationHint": "Digital Flora of Indonesia angiosperm family and species pages",
    "releaseCadence": "continuous",
    "fieldMappingFocus": ["family index", "species list by family", "indonesia region mentions", "source citations embedded in page"],
    "rawSnapshotPath": "data/biodiversity/raw/digital-flora-indonesia-angiosperms/",
    "checksumRequired": false,
    "notes": "Country-specific flora source with static family pages that are parseable from this environment"
  },
  {
    "id": "powo",
    "group": "flora",
    "role": "global plant validation",
    "priority": "high",
    "url": "https://powo.science.kew.org/",
    "access": "public web / dataset workflow",
    "authRequired": false,
    "retrievalMethod": "dataset workflow",
    "license": "Kew terms apply",
    "citationHint": "Plants of the World Online / WCVP",
    "releaseCadence": "weekly or release based",
    "fieldMappingFocus": ["plant taxonomy", "distribution validation"],
    "rawSnapshotPath": "data/biodiversity/raw/powo/",
    "checksumRequired": true,
    "notes": "Use with WCVP for plant taxonomy and distribution validation"
  },
  {
    "id": "mammal-diversity-database",
    "group": "fauna-mammals",
    "role": "mammal checklist",
    "priority": "high",
    "url": "https://www.mammaldiversity.org/country/ID/",
    "access": "public web / downloadable data",
    "authRequired": false,
    "retrievalMethod": "download",
    "license": "MDD terms apply",
    "citationHint": "ASM Mammal Diversity Database country records",
    "releaseCadence": "release based",
    "fieldMappingFocus": ["mammal checklist", "mammal taxonomy"],
    "rawSnapshotPath": "data/biodiversity/raw/mammal-diversity-database/",
    "checksumRequired": true,
    "notes": "Authoritative mammal source for Indonesia"
  },
  {
    "id": "mdd-indonesia",
    "group": "fauna-mammals",
    "role": "indonesia mammal country summary",
    "priority": "high",
    "url": "https://www.mammaldiversity.org/country/ID/",
    "access": "public web",
    "authRequired": false,
    "retrievalMethod": "fetch",
    "license": "website terms apply",
    "citationHint": "ASM Mammal Diversity Database Indonesia country page",
    "releaseCadence": "continuous",
    "fieldMappingFocus": ["mammal totals", "order counts", "country-level mammal diversity summary"],
    "rawSnapshotPath": "data/biodiversity/raw/mdd-indonesia/",
    "checksumRequired": false,
    "notes": "Country page is fetchable from this environment and exposes Indonesia mammal totals plus per-order counts"
  },
  {
    "id": "ebird",
    "group": "fauna-birds",
    "role": "bird observation layer",
    "priority": "high",
    "url": "https://ebird.org/region/ID",
    "access": "public web + api",
    "authRequired": true,
    "retrievalMethod": "api",
    "license": "eBird data use policy",
    "citationHint": "eBird regional observations and checklists",
    "releaseCadence": "continuous",
    "fieldMappingFocus": ["bird observations", "recent records", "regional checklists"],
    "rawSnapshotPath": "data/biodiversity/raw/ebird/",
    "checksumRequired": true,
    "notes": "Best live bird observation layer; API key required"
  },
  {
    "id": "birdlife",
    "group": "fauna-birds",
    "role": "bird conservation authority",
    "priority": "high",
    "url": "https://datazone.birdlife.org/country/factsheet/indonesia",
    "access": "public web / requested downloads",
    "authRequired": false,
    "retrievalMethod": "fetch",
    "license": "BirdLife terms and requested data access",
    "citationHint": "BirdLife DataZone Indonesia factsheet",
    "releaseCadence": "annual or ad hoc",
    "fieldMappingFocus": ["bird conservation context", "range framing"],
    "rawSnapshotPath": "data/biodiversity/raw/birdlife/",
    "checksumRequired": false,
    "notes": "Best for bird conservation framing and range context"
  },
  {
    "id": "reptile-database",
    "group": "fauna-reptiles",
    "role": "reptile taxonomy",
    "priority": "high",
    "url": "http://www.reptile-database.org/data/",
    "access": "public download",
    "authRequired": false,
    "retrievalMethod": "download",
    "license": "Reptile Database terms apply",
    "citationHint": "Reptile Database downloadable taxonomy dump",
    "releaseCadence": "release based",
    "fieldMappingFocus": ["reptile taxonomy", "reptile checklist"],